{
  "schemaVersion": 1,
  "id": "appstore-ios",
  "version": "1.0.0",
  "authority": "apple",
  "title": "iPhone app, from a built shot to a live App Store listing",
  "summary": "The steps only the owner can take. TOHSENO builds the app; Apple requires a human for enrollment, identity, listing, and submission.",
  "reviewedOn": "2026-07-24",
  "sourceUrls": [
    "https://developer.apple.com/programs/enroll/",
    "https://developer.apple.com/help/account/membership/program-enrollment/"
  ],
  "steps": [
    {
      "id": "apple-account-2fa",
      "stage": "account",
      "title": "Apple Account with two-factor authentication",
      "line": "Turn on two-factor authentication for your Apple Account.",
      "url": "https://account.apple.com",
      "requires": [],
      "detector": { "type": "manual" }
    },
    {
      "id": "developer-program-enrollment",
      "stage": "account",
      "title": "Apple Developer Program enrollment",
      "line": "Enroll in the Apple Developer Program. $99/year, your own card.",
      "url": "https://developer.apple.com/programs/enroll/",
      "requires": ["apple-account-2fa"],
      "detector": { "type": "manual" },
      "cost": { "amount": 99, "currency": "USD", "recurrence": "yearly" },
      "waitsOn": { "party": "Apple identity verification", "typical": "24 hours to 2 weeks" }
    },
    {
      "id": "signing-team",
      "stage": "signing",
      "title": "Signing team selected",
      "line": "Open the project in Xcode and pick your team under Signing.",
      "requires": ["developer-program-enrollment"],
      "detector": {
        "type": "command",
        "tool": "security",
        "arguments": ["find-identity", "-v", "-p", "codesigning"],
        "expectPattern": "Apple Development|Apple Distribution"
      }
    },
    {
      "id": "bundle-id-registered",
      "stage": "signing",
      "title": "Bundle identifier registered",
      "line": "Register this app's bundle identifier on the developer site.",
      "url": "https://developer.apple.com/account/resources/identifiers/list",
      "requires": ["developer-program-enrollment"],
      "detector": { "type": "manual" }
    },
    {
      "id": "app-record",
      "stage": "listing",
      "title": "App record in App Store Connect",
      "line": "Create the app record in App Store Connect using that bundle ID.",
      "url": "https://appstoreconnect.apple.com/apps",
      "requires": ["bundle-id-registered"],
      "detector": { "type": "manual" }
    },
    {
      "id": "privacy-policy-url",
      "stage": "listing",
      "title": "Privacy policy URL",
      "line": "Publish a privacy policy and paste its URL into App Store Connect.",
      "requires": ["app-record"],
      "detector": { "type": "manual" }
    },
    {
      "id": "privacy-manifest",
      "stage": "build",
      "title": "Privacy manifest and Required Reason APIs",
      "line": "Confirm PrivacyInfo.xcprivacy declares every Required Reason API used.",
      "requires": [],
      "detector": { "type": "file", "path": "App/PrivacyInfo.xcprivacy" }
    },
    {
      "id": "screenshots-iphone",
      "stage": "listing",
      "title": "iPhone screenshots",
      "line": "Capture at least 3 screenshots on a 6.9-inch iPhone.",
      "requires": [],
      "detector": {
        "type": "file",
        "glob": ".tohseno/evidence/screenshots/iphone-6-9/*.png",
        "minMatches": 3
      }
    },
    {
      "id": "screenshots-ipad",
      "stage": "listing",
      "title": "iPad screenshots",
      "line": "Capture at least 3 screenshots on a 13-inch iPad Pro.",
      "requires": [],
      "appliesWhen": { "supportsIpad": true },
      "detector": {
        "type": "file",
        "glob": ".tohseno/evidence/screenshots/ipad-13/*.png",
        "minMatches": 3
      }
    },
    {
      "id": "privacy-labels",
      "stage": "listing",
      "title": "App privacy labels",
      "line": "Answer the App Privacy questions in App Store Connect.",
      "url": "https://appstoreconnect.apple.com/apps",
      "requires": ["app-record"],
      "detector": { "type": "manual" }
    },
    {
      "id": "age-rating",
      "stage": "listing",
      "title": "Age rating",
      "line": "Complete the age rating questionnaire. Apple enforces it strictly now.",
      "requires": ["app-record"],
      "detector": { "type": "manual" }
    },
    {
      "id": "ai-content-disclosure",
      "stage": "listing",
      "title": "Generative AI disclosure",
      "line": "Disclose generated content and its age rating impact.",
      "requires": ["app-record"],
      "appliesWhen": { "usesGenerativeAi": true },
      "detector": { "type": "manual" }
    },
    {
      "id": "crypto-disclosure",
      "stage": "review",
      "title": "Wallet and digital asset disclosure",
      "line": "Expect extra review scrutiny: declare wallet behavior precisely.",
      "requires": ["app-record"],
      "appliesWhen": { "identityStrategy": ["wallet"] },
      "detector": { "type": "manual" }
    },
    {
      "id": "archive-uploaded",
      "stage": "build",
      "title": "Build uploaded",
      "line": "Archive the app and upload the build to App Store Connect.",
      "requires": ["signing-team", "app-record", "privacy-manifest"],
      "detector": { "type": "manual" }
    },
    {
      "id": "testflight-tested",
      "stage": "build",
      "title": "Tested on your own iPhone",
      "line": "Install the TestFlight build on your iPhone and use it once.",
      "requires": ["archive-uploaded"],
      "detector": { "type": "manual" },
      "waitsOn": { "party": "Apple build processing", "typical": "minutes to a few hours" }
    },
    {
      "id": "submit-for-review",
      "stage": "review",
      "title": "Submitted for review",
      "line": "Submit for review. This one you cannot take back.",
      "url": "https://appstoreconnect.apple.com/apps",
      "requires": [
        "privacy-policy-url",
        "privacy-labels",
        "age-rating",
        "screenshots-iphone",
        "testflight-tested"
      ],
      "detector": { "type": "manual" },
      "irreversible": true,
      "waitsOn": { "party": "Apple App Review", "typical": "24 to 48 hours" }
    }
  ]
}
